{
  "context_manifest_ref": {
    "digest": "sha256:c6dfa2601b1cd02ebb5f45cad7825637ba3aeb6f06bc5ae8b05b87d1d67d3d03",
    "id": "context-manifest/reviewer-independent-fixture-v1"
  },
  "findings": [],
  "implementer_transcript_received": false,
  "metadata": {
    "fixture_only": true,
    "note": "Planning/conformance fixture; not production qualification or provider evidence."
  },
  "patch_ref": {
    "digest": "sha256:5d4a5e68e8e1b6a0be5eebf194e78da635168229d3a857291dbdf9551eb058b7",
    "id": "pat_5d4a5e68e8e1b6a0be5eebf194e78da6"
  },
  "plan_ref": {
    "digest": "sha256:48e474ac89fbe3d9498c83fb6d4254ba41677246fcbcc6f0be352bc25c852118",
    "id": "pln_48e474ac89fbe3d9498c83fb6d4254ba"
  },
  "result_state_digest": "sha256:5eedf3fa774f0dc44ba024cd71f91d13509e55111d7373dde2c464962715a5a5",
  "review_id": "rev_bbd0d94ecb125f2caa587bd8ab4c33bb",
  "reviewer_assignment_ref": {
    "digest": "sha256:25bf8224367a8c0d6ec4fc1d6584d8be1c8339efdf3db771d49b46060075f159",
    "id": "asg_25bf8224367a8c0d6ec4fc1d6584d8be"
  },
  "schema": "engineering-system/review/m0-v1",
  "semantic_digest": "sha256:bbd0d94ecb125f2caa587bd8ab4c33bbf9dc60540d17636ba2b883fb652cd3d3",
  "verdict": "APPROVE",
  "verification_ref": {
    "digest": "sha256:ca3c60dcb20fa8cd04df7b8662d5183e7693ea2f2bd4b2b640973058d64038f7",
    "id": "ver_ca3c60dcb20fa8cd04df7b8662d5183e"
  }
}
